{
  "id": "DingTalk-Real-AI/dingtalk-workspace-cli",
  "name": "DingTalk",
  "aliases": [],
  "description": "DingTalk workspace command line tool for automating DingTalk collaboration workflows.",
  "repo_url": "https://github.com/DingTalk-Real-AI/dingtalk-workspace-cli",
  "homepage": "",
  "install": {},
  "category": "AI & Agents",
  "tags": [
    "agent-friendly",
    "awesome-list"
  ],
  "github_stars": 2487,
  "agent": {
    "score": 3,
    "friendly": true,
    "signals": [
      "awesome-ai-cli",
      "curated-agent-list"
    ],
    "skill_url": null
  },
  "sources": [
    {
      "id": "awesome-ai-cli",
      "repo": "luoyuctl/awesome-ai-cli",
      "commit": "b1957619c34be84cb1d822baf419dc124daacec0"
    }
  ],
  "meta": {
    "first_seen_at": "2026-07-21",
    "updated_at": "2026-07-21",
    "status": "active",
    "github_stars_updated_at": "2026-07-21T13:03:12+08:00",
    "manual_edit": true
  }
}
