{
  "id": "maraloon/pickdate",
  "name": "tui-datepicker",
  "aliases": [],
  "description": "Select date in terminal with vim-motions and copy to buffer.",
  "repo_url": "https://github.com/maraloon/pickdate",
  "homepage": "",
  "install": {},
  "category": "Files & Search",
  "tags": [
    "fuzzy-finders-and-option-pickers",
    "option-picker"
  ],
  "github_stars": 46,
  "agent": {
    "score": 1,
    "friendly": false,
    "signals": [],
    "skill_url": null
  },
  "sources": [
    {
      "id": "toolleeo-csv",
      "repo": "toolleeo/awesome-cli-apps-in-a-csv",
      "commit": "226eefaa1bc32f1eea2a03c56a2a1f2615c48f5f",
      "upstream_category": "option-picker"
    }
  ],
  "meta": {
    "first_seen_at": "2026-07-21",
    "updated_at": "2026-07-21",
    "status": "active",
    "github_stars_updated_at": "2026-07-21T13:03:12+08:00"
  }
}
