{
  "id": "processone/ejabberd",
  "name": "ejabberd",
  "aliases": [],
  "description": "ejabberd is an XMPP application server and an MQTT broker, written mainly in the Erlang programming language.",
  "repo_url": "https://github.com/processone/ejabberd",
  "homepage": "https://www.ejabberd.im/",
  "install": {},
  "category": "Network & API",
  "tags": [
    "networking"
  ],
  "github_stars": 6710,
  "agent": {
    "score": 1,
    "friendly": false,
    "signals": [],
    "skill_url": null
  },
  "sources": [
    {
      "id": "toolleeo-csv",
      "repo": "toolleeo/awesome-cli-apps-in-a-csv",
      "commit": "226eefaa1bc32f1eea2a03c56a2a1f2615c48f5f",
      "upstream_category": "networking"
    }
  ],
  "meta": {
    "first_seen_at": "2026-07-21",
    "updated_at": "2026-07-21",
    "status": "active",
    "github_stars_updated_at": "2026-07-21T13:03:12+08:00"
  }
}
