{
  "id": "AngelJumbo/sssnake",
  "name": "sssnake",
  "aliases": [],
  "description": "(Smart and sexy snake) The classic snake game for the terminal that can plays itself and be use like a screensaver.",
  "repo_url": "https://github.com/AngelJumbo/sssnake",
  "homepage": "",
  "install": {},
  "category": "Utilities",
  "tags": [
    "games"
  ],
  "github_stars": 233,
  "agent": {
    "score": 1,
    "friendly": false,
    "signals": [],
    "skill_url": null
  },
  "sources": [
    {
      "id": "toolleeo-csv",
      "repo": "toolleeo/awesome-cli-apps-in-a-csv",
      "commit": "226eefaa1bc32f1eea2a03c56a2a1f2615c48f5f",
      "upstream_category": "games"
    }
  ],
  "meta": {
    "first_seen_at": "2026-07-21",
    "updated_at": "2026-07-21",
    "status": "active",
    "github_stars_updated_at": "2026-07-21T13:03:12+08:00"
  }
}
