{
  "id": "bugnano/rnr",
  "name": "rnr",
  "aliases": [],
  "description": "The RNR File Manager (RNR's Not Ranger) is a text based file manager that combines the best features of Midnight Commander and Ranger.",
  "repo_url": "https://github.com/bugnano/rnr",
  "homepage": "",
  "install": {},
  "category": "Files & Search",
  "tags": [
    "file-manager"
  ],
  "github_stars": 54,
  "agent": {
    "score": 1,
    "friendly": false,
    "signals": [],
    "skill_url": null
  },
  "sources": [
    {
      "id": "toolleeo-csv",
      "repo": "toolleeo/awesome-cli-apps-in-a-csv",
      "commit": "226eefaa1bc32f1eea2a03c56a2a1f2615c48f5f",
      "upstream_category": "file-manager"
    }
  ],
  "meta": {
    "first_seen_at": "2026-07-21",
    "updated_at": "2026-07-21",
    "status": "active",
    "github_stars_updated_at": "2026-07-21T13:03:12+08:00"
  }
}
