{
  "id": "agl-alexglopez/maze-tui",
  "name": "Maze TUI",
  "aliases": [],
  "description": "Build mazes, solve them with various algorithms and visualize them.",
  "repo_url": "https://github.com/agl-alexglopez/maze-tui",
  "homepage": "",
  "install": {},
  "category": "Development",
  "tags": [
    "learning",
    "learning-and-didactic-tools"
  ],
  "github_stars": 83,
  "agent": {
    "score": 1,
    "friendly": false,
    "signals": [],
    "skill_url": null
  },
  "sources": [
    {
      "id": "toolleeo-csv",
      "repo": "toolleeo/awesome-cli-apps-in-a-csv",
      "commit": "226eefaa1bc32f1eea2a03c56a2a1f2615c48f5f",
      "upstream_category": "learning"
    }
  ],
  "meta": {
    "first_seen_at": "2026-07-21",
    "updated_at": "2026-07-21",
    "status": "active",
    "github_stars_updated_at": "2026-07-21T13:03:12+08:00"
  }
}
