{
  "id": "Chleba/tui-slides",
  "name": "tui-slides",
  "aliases": [],
  "description": "TerminalpPresentation program with modern TUI.",
  "repo_url": "https://github.com/Chleba/tui-slides",
  "homepage": "",
  "install": {},
  "category": "Productivity",
  "tags": [
    "office",
    "office-tools"
  ],
  "github_stars": 83,
  "agent": {
    "score": 1,
    "friendly": false,
    "signals": [],
    "skill_url": null
  },
  "sources": [
    {
      "id": "toolleeo-csv",
      "repo": "toolleeo/awesome-cli-apps-in-a-csv",
      "commit": "226eefaa1bc32f1eea2a03c56a2a1f2615c48f5f",
      "upstream_category": "office"
    }
  ],
  "meta": {
    "first_seen_at": "2026-07-21",
    "updated_at": "2026-07-21",
    "status": "active",
    "github_stars_updated_at": "2026-07-21T13:03:12+08:00"
  }
}
