{
  "id": "sweetbbak/toru",
  "name": "toru",
  "aliases": [],
  "description": "BitTorrent streaming CLI tool to stream anime torrents in real-time with no waiting for downloads.",
  "repo_url": "https://github.com/sweetbbak/toru",
  "homepage": "",
  "install": {},
  "category": "Network & API",
  "tags": [
    "torrent"
  ],
  "github_stars": 387,
  "agent": {
    "score": 1,
    "friendly": false,
    "signals": [],
    "skill_url": null
  },
  "sources": [
    {
      "id": "toolleeo-csv",
      "repo": "toolleeo/awesome-cli-apps-in-a-csv",
      "commit": "226eefaa1bc32f1eea2a03c56a2a1f2615c48f5f",
      "upstream_category": "torrent"
    }
  ],
  "meta": {
    "first_seen_at": "2026-07-21",
    "updated_at": "2026-07-21",
    "status": "active",
    "github_stars_updated_at": "2026-07-21T13:03:12+08:00"
  }
}
