{
  "id": "AlDanial/cloc",
  "name": "cloc",
  "aliases": [],
  "description": "Tool for counting blank lines, comment lines, and physical lines of source code in many programming languages.",
  "repo_url": "https://github.com/AlDanial/cloc",
  "homepage": "",
  "install": {},
  "category": "Development",
  "tags": [
    "programming"
  ],
  "github_stars": 23314,
  "agent": {
    "score": 1,
    "friendly": false,
    "signals": [],
    "skill_url": null
  },
  "sources": [
    {
      "id": "toolleeo-csv",
      "repo": "toolleeo/awesome-cli-apps-in-a-csv",
      "commit": "226eefaa1bc32f1eea2a03c56a2a1f2615c48f5f",
      "upstream_category": "programming"
    }
  ],
  "meta": {
    "first_seen_at": "2026-07-21",
    "updated_at": "2026-07-21",
    "status": "active",
    "github_stars_updated_at": "2026-07-21T13:03:12+08:00"
  }
}
