{
  "id": "mat2cc/redis_tui",
  "name": "redis_tui",
  "aliases": [],
  "description": "Redis terminal browser application.",
  "repo_url": "https://github.com/mat2cc/redis_tui",
  "homepage": "",
  "install": {},
  "category": "Data & JSON",
  "tags": [
    "data-management"
  ],
  "github_stars": 118,
  "agent": {
    "score": 1,
    "friendly": false,
    "signals": [],
    "skill_url": null
  },
  "sources": [
    {
      "id": "toolleeo-csv",
      "repo": "toolleeo/awesome-cli-apps-in-a-csv",
      "commit": "226eefaa1bc32f1eea2a03c56a2a1f2615c48f5f",
      "upstream_category": "data-management"
    }
  ],
  "meta": {
    "first_seen_at": "2026-07-21",
    "updated_at": "2026-07-21",
    "status": "active",
    "github_stars_updated_at": "2026-07-21T13:03:12+08:00"
  }
}
